{
  "artifacts": {
    "report.json": {
      "bytes": 1593,
      "sha256": "558b2a0c692b2e19b834fb817d19027e17e00c24691c4d934aec5b675e585b58"
    },
    "report.md": {
      "bytes": 1253,
      "sha256": "8ce120c0b6a29f8baa4485d08d4b474540963576c2d94f002e61b34eb3c28a22"
    }
  },
  "engine": {
    "name": "soc-replay",
    "version": "2.1.0"
  },
  "inputs": {
    "events_sha256": "d8f7fd8602e576e8c0babd64b4394a879d8327c9b92f764755038897ddd7f430",
    "scenario_sha256": "38ad522bc081308a353a99845af69d92e505ac5355aea890cce55c8d418642a9"
  },
  "manifest_schema_version": "1.0",
  "run_id": "d1ddeedd82f61237",
  "verification_passed": true
}
